{
  "registry_schema_version": "1.1.0",
  "id": "AA-BND-TRD-SYSTEMS-PRO-048",
  "type": "bundle",
  "name": "Trading Systems Kit",
  "description": "Bundle with signal, paper, and live execution assets plus risk controls.",
  "version": "1.0.0",
  "format": "mixed",
  "files": [],
  "checksum": "sha256:manifest-only",
  "size_bytes": 0,
  "compatibility": ["openai", "anthropic", "langchain"],
  "dependencies": ["market_data_api", "exchange_api", "prediction_market_api"],
  "required_secrets": ["MARKET_DATA_API_KEY", "EXCHANGE_API_KEY"],
  "license": {
    "type": "commercial",
    "seats": 20,
    "redistribution_policy": "no_redistribution",
    "commercial_use": true
  },
  "price_usd": 2499,
  "currency": "USD",
  "billing_type": "one_time",
  "availability": "draft",
  "created_at": "2026-02-22T12:00:00Z",
  "updated_at": "2026-02-22T12:00:00Z",
  "urls": {
    "product_page": "https://agentassets.io/products/bundle-trading-systems-kit",
    "docs": "https://agentassets.io/docs/bundle-trading-systems-kit",
    "download_endpoint": "https://api.agentassets.io/downloads/AA-BND-TRD-SYSTEMS-PRO-048",
    "sample_endpoint": "https://api.agentassets.io/samples/AA-BND-TRD-SYSTEMS-PRO-048",
    "changelog": "https://agentassets.io/changelog/AA-BND-TRD-SYSTEMS-PRO-048"
  },
  "tags": ["bundle", "trading", "live execution"],
  "keywords": ["trading systems bundle", "live execution bundle"],
  "support": {
    "level": "priority",
    "contact": "support@agentassets.io",
    "sla": "same business day"
  },
  "bundle_contents": [
    {"product_id": "AA-SKL-TRD-EXECADAPTER-PRO-023", "quantity": 1, "notes": "connector skill"},
    {"product_id": "AA-AGT-TRD-PAPERORCH-PRO-029", "quantity": 1, "notes": "paper workflow"},
    {"product_id": "AA-AGT-TRD-LIVECOORD-PRO-030", "quantity": 1, "notes": "live coordinator"},
    {"product_id": "AA-UTL-TRD-RISKPOLICYKIT-PRO-038", "quantity": 1, "notes": "risk controls"}
  ],
  "execution_mode": "mixed",
  "market_type": "hybrid",
  "connector_type": ["api", "websocket", "webhook"],
  "risk_level": "high",
  "disclosure_required": true,
  "disclosure_profile": {
    "disclosure_version": "DISC-1.0.0",
    "ack_required": true,
    "display_context": ["product_page", "checkout", "download"]
  }
}
